{
  "candidate_id": "CAND-LRT-Q25-15B-Q8-R1",
  "pairing_revision": "litert-lm-v0.16.0-arm64-wip-r1",
  "platform": "ubuntu-aarch64",
  "protocol_version": "snowboard.llm/1",
  "driver": "litert_lm",
  "runtime_path": "/tmp/llm-poc-g1-arm64-001/bundle/litert_lm_api-0.16.0-py3-none-manylinux_2_27_aarch64.whl",
  "model_path": "/tmp/llm-poc-g1-arm64-001/bundle/CAND-LRT-Q25-15B-Q8-R1/Qwen2.5-1.5B-Instruct_multi-prefill-seq_q8_ekv4096.litertlm",
  "runtime_sha256": "5eb8c9faa5727730239591f8c912261ec7705512d5f30ec674586bc0005f2b00",
  "model_sha256": "faa60663b333290c1496c499828b21d3e3254a788cacd8cce917ce0f761a2dc9",
  "max_input_tokens": 128,
  "max_output_tokens": 16,
  "temperature": 0.0,
  "top_p": 1.0,
  "threads": 4,
  "ready_timeout_ms": 180000,
  "generate_timeout_ms": 15000,
  "cancel_timeout_ms": 500,
  "term_timeout_ms": 2000,
  "kill_timeout_ms": 1000,
  "rebuild_timeout_ms": 10000,
  "runtime_download": false,
  "network_fallback": false,
  "fallback_model": null
}
